<?xml version="1.0"?>
<!DOCTYPE library SYSTEM "rules.dtd">
<!--bkinfo-->

<library
        xmlns="randomNS"
        xmlns:xsi="http://www.w3.org/2001/XMLSchema-instance"
        xsi:schemaLocation="randomNS test.xsd"
>

    <info>
        <location> Ancient Egypt </location>
        <description> The ancient library of magic </description>
        <librarian> Ali </librarian>
    </info>

    <books>
        <book element = "FIRE">
            <info>
                <title> Basic Magic: Fire Spells </title>
                <isbn>
                    <![CDATA[
                        978-3-16-148410-0
                    ]]> </isbn>
                <author> <![CDATA[ Great Magus &Author; && Great Magus Mist ]]></author>
            </info>
            <preface> Intro into magic starting with basics and focusing on fire magic </preface>
            <parts>
                <part>
                    <title> Controlling magic energy </title>
                    <chapters>
                        <chapter>
                            <title>  Learning focus techniques </title>
                            <summary> The focus begins from within </summary>
                            <sections>
                                <section> Follow this stance and empty your mind, don't think about anything at all </section>
                            </sections>
                        </chapter>
                        <chapter>
                            <title>  Understanding natural energy circulation </title>
                            <summary> The focus begins from within </summary>
                            <sections>
                                <section> Follow this stance and empty your mind, don't think about anything at all </section>
                            </sections>
                        </chapter>
                        <chapter>
                            <title>  Visualising the energy </title>
                            <summary> The focus begins from within </summary>
                            <sections>
                                <section> Follow this stance and empty your mind, don't think about anything at all </section>
                            </sections>
                        </chapter>
                    </chapters>
                </part>
                <part>
                    <title> Manipulating magic energy into fire </title>
                    <chapters>
                        <chapter>
                            <title>  Learning focus techniques </title>
                            <summary> The focus begins from within </summary>
                            <sections>
                                <section> Follow this stance and empty your mind, don't think about anything at all </section>
                            </sections>
                        </chapter>
                        <chapter>
                            <title>  Understanding natural energy circulation </title>
                            <summary> The focus begins from within </summary>
                            <sections>
                                <section> Follow this stance and empty your mind, don't think about anything at all </section>
                            </sections>
                        </chapter>
                        <chapter>
                            <title>  Visualising the energy </title>
                            <summary> The focus begins from within </summary>
                            <sections>
                                <section> Follow this stance and empty your mind, don't think about anything at all </section>
                            </sections>
                        </chapter>
                    </chapters>
                </part>
            </parts>
        </book>
        <br/>
        <book element = "WATER">
            <info>
                <title> Basic Magic: Water Spells </title>
                <isbn>
                    <![CDATA[
                        978-3-16-148410-0
                    ]]> </isbn>
                <author> <![CDATA[ Great Magus Zord && Great Magus Mist ]]></author>
            </info>
            <preface> Intro into magic starting with basics and focusing on water magic </preface>
            <parts>
                <part>
                    <title> Controlling magic energy </title>
                    <chapters>
                        <chapter>
                            <title>  Learning focus techniques </title>
                            <summary> The focus begins from within </summary>
                            <sections>
                                <section> Follow this stance and empty your mind, don't think about anything at all </section>
                            </sections>
                        </chapter>
                        <chapter>
                            <title>  Understanding natural energy circulation </title>
                            <summary> The focus begins from within </summary>
                            <sections>
                                <section> Follow this stance and empty your mind, don't think about anything at all </section>
                            </sections>
                        </chapter>
                        <chapter>
                            <title>  Visualising the energy </title>
                            <summary> The focus begins from within </summary>
                            <sections>
                                <section> Follow this stance and empty your mind, don't think about anything at all </section>
                            </sections>
                        </chapter>
                    </chapters>
                </part>
                <part>
                    <title> Manipulating magic energy into water </title>
                    <chapters>
                        <chapter>
                            <title>  Learning focus techniques </title>
                            <summary> The focus begins from within </summary>
                            <sections>
                                <section> Follow this stance and empty your mind, don't think about anything at all </section>
                            </sections>
                        </chapter>
                        <chapter>
                            <title>  Understanding natural energy circulation </title>
                            <summary> The focus begins from within </summary>
                            <sections>
                                <section> Follow this stance and empty your mind, don't think about anything at all </section>
                            </sections>
                        </chapter>
                        <chapter>
                            <title>  Visualising the energy </title>
                            <summary> The focus begins from within </summary>
                            <sections>
                                <section> Follow this stance and empty your mind, don't think about anything at all </section>
                            </sections>
                        </chapter>
                    </chapters>
                </part>
            </parts>
        </book>
        <br />
    </books>

</library>

